{
  "scene_type": "unknown",
  "confidence": 0.9,
  "title": "会议通知",
  "time": {
    "start_text": "今晚10:00",
    "deadline_text": null,
    "normalized_start": "2026-04-24T18:30:00+08:00",
    "normalized_deadline": null
  },
  "location": {
    "raw": "腾讯会议",
    "map_query": "腾讯会议",
    "confidence": 0.84
  },
  "task": {
    "summary": "准备会议进展和待协调事项",
    "priority": "medium",
    "topic": "unknown"
  },
  "suggested_actions": [
    {"type": "calendar", "label": "加入会议日历", "requires_permission": true},
    {"type": "reminder", "label": "会前提醒准备", "requires_permission": true},
    {"type": "map", "label": "打开会议地点", "requires_permission": false}
  ],
  "missing_fields": [],
  "explanation": "识别到会议语义，但当前公开契约不扩展 scene_type，按 unknown 处理并给出可执行动作。"
}
