{
  "scene_type": "unknown",
  "confidence": 0.92,
  "title": "作业提交截止",
  "time": {
    "start_text": null,
    "deadline_text": "今晚22:00",
    "normalized_start": null,
    "normalized_deadline": "2026-04-24T22:00:00+08:00"
  },
  "location": {
    "raw": "教学平台",
    "map_query": "教学平台",
    "confidence": 0.84
  },
  "task": {
    "summary": "按要求提交作业材料",
    "priority": "high",
    "topic": "unknown"
  },
  "suggested_actions": [
    {"type": "calendar", "label": "加入截止日历", "requires_permission": true},
    {"type": "reminder", "label": "截止前提醒提交", "requires_permission": true},
    {"type": "map", "label": "打开提交入口", "requires_permission": false}
  ],
  "missing_fields": [],
  "explanation": "识别到作业/截止语义，但当前公开契约不扩展 scene_type，按 unknown 处理并给出可执行动作。"
}
